商品代码,描述,交易所,焦点,指定年度股息,指定年度股息 - 货币,分类,发行人,品牌,指数追踪,策略,资产类别,价格 * 平均交易量 90天,价格 * 平均交易量 90天 - 货币
CAOS,Alpha Architect Tail Risk ETF,CBOE,目标结果,,,资产分配,Empirical Finance LLC,Alpha Architect,No Underlying Index,活跃榜,资产分配,3656662.3328511105,USD
AGGY,WisdomTree Yield Enhanced U.S. Aggregate Bond Fund,NYSE Arca,投资等级,1.974,USD,广阔市场，基础广泛,"WisdomTree, Inc.",WisdomTree,Bloomberg US Aggregate Yield Enhanced,多因素,固定收入,3647048.9114633324,USD
HEDJ,WisdomTree Europe Hedged Equity Fund,NYSE Arca,总市场,0.865,USD,大小和样式,"WisdomTree, Inc.",WisdomTree,WisdomTree Europe Hedged Equity Index,基本面,净值,3631477.73865111,USD
RAAX,VanEck Real Assets ETF,NYSE Arca,目标结果,0.816,USD,资产分配,Van Eck Associates Corp.,VanEck,No Underlying Index,活跃榜,资产分配,3624271.9287444446,USD
BERZ,MicroSectors Solactive FANG & Innovation -3X Inverse Leveraged ETN,NYSE Arca,主题,,,板块,Bank of Montreal,REX Microsectors,Solactive FANG Innovation Index,等于,净值,3623780.133033332,USD
PBDC,Putnam BDC Income ETF,NYSE Arca,财务指标,3.223,USD,板块,"Franklin Resources, Inc.",Putnam,No Underlying Index,活跃榜,净值,3593498.1049477775,USD
RSPU,Invesco S&P 500 Equal Weight Utilities ETF,NYSE Arca,公用事业,1.902,USD,板块,Invesco Ltd.,Invesco,S&P 500 Equal Weighted / Utilities Plus,等于,净值,3592367.982126667,USD
IBTL,iShares iBonds Dec 2031 Term Treasury ETF,NASDAQ,投资等级,0.808,USD,政府，财政部,"BlackRock, Inc.",iShares,ICE 2031 Maturity US Treasury,子弹债券到期,固定收入,3581744.600488888,USD
EWZS,iShares MSCI Brazil Small-Cap ETF,NASDAQ,小盘,0.490154,USD,大小和样式,"BlackRock, Inc.",iShares,MSCI Brazil Small Cap,普通,净值,3579641.4471177785,USD
KORP,American Century Diversified Corporate Bond ETF,NYSE Arca,广泛信用,2.355,USD,企业，基础广泛,"American Century Cos., Inc.",American Century,No Underlying Index,活跃榜,固定收入,3575027.3981988896,USD
IWLG,NYLI Winslow Large Cap Growth ETF,NYSE Arca,大盘,0.00133,USD,大小和样式,New York Life Insurance Co.,New York Life Investments,No Underlying Index,活跃榜,净值,3562199.0084255543,USD
PABU,iShares Paris-Aligned Climate Optimized MSCI USA ETF,NASDAQ,主题,0.658,USD,板块,"BlackRock, Inc.",iShares,,ESG,净值,3549218.994591111,USD
IYRI,NEOS Real Estate High Income ETF,CBOE,房地产,5.644,USD,板块,NEOS Investments LLC,Neos,No Underlying Index,活跃榜,净值,3547398.695777778,USD
QAI,NYLI Hedge Multi-Strategy Tracker ETF,NYSE Arca,多策略,0.504,USD,对冲基金策略,New York Life Insurance Co.,New York Life Investments,IQ Hedge Multi-Strategy Index,多因素,替代品,3535207.8840700006,USD
EFIV,State Street SPDR S&P 500 ESG ETF,NYSE Arca,大盘,0.68,USD,大小和样式,State Street Corp.,SPDR,S&P 500 Scored & Screened Index,ESG,净值,3530441.963054447,USD
SUSL,iShares ESG MSCI USA Leaders ETF,NASDAQ,总市场,1.195,USD,大小和样式,"BlackRock, Inc.",iShares,MSCI USA Extended ESG Leaders,ESG,净值,3522597.6068455563,USD
RETL,Direxion Daily Retail Bull 3x Shares,NYSE Arca,非必需消费品,0.05363,USD,板块,Rafferty Asset Management LLC,Direxion,S&P Retail Select Industry,等于,净值,3522543.142999999,USD
BRZU,Direxion Daily MSCI Brazil Bull 2X Shares,NYSE Arca,总市场,1.905,USD,大小和样式,Rafferty Asset Management LLC,Direxion,MSCI Brazil 25-50,普通,净值,3513059.0560911098,USD
GSSC,TR Activebeta US Small Cap Equity ETF,NYSE Arca,小盘,0.888,USD,大小和样式,"The Goldman Sachs Group, Inc.",Goldman Sachs,Goldman Sachs ActiveBeta US Small Cap Equity,多因素,净值,3513059.0001411135,USD
QETH,Invesco Galaxy Ethereum ETF,CBOE,做多以太币，做空美元,,,对,Invesco Ltd.,Invesco,ETH/USD Exchange Rate - USD - Benchmark Price Return,普通,货币,3508302.308111112,USD
EQL,Alps Equal Sector Weight ETF,NYSE Arca,大盘,0.801,USD,大小和样式,"SS&C Technologies Holdings, Inc.",ALPS,NYSE Select Sector Equal Weight Index,等于,净值,3503767.9869811125,USD
PTL,Inspire 500 ETF,NYSE Arca,大盘,3.089,USD,大小和样式,Inspire Impact Group LLC,Inspire,Inspire 500 Index - Benchmark TR Gross,ESG,净值,3481357.313668889,USD
DBEU,Xtrackers MSCI Europe Hedged Equity ETF,NYSE Arca,总市场,2.185,USD,大小和样式,Deutsche Bank AG,Xtrackers,MSCI Europe 100% Hedged to USD Net Variant,普通,净值,3481337.776146666,USD
FJAN,FT Vest US Equity Buffer ETF - January,CBOE,下行风险对冲,,,结构化结果,AJM Ventures LLC,FT Vest,No Underlying Index,买权,替代品,3464836.4705944452,USD
SEIV,SEI Enhanced U.S. Large Cap Value Factor ETF,CBOE,大盘,0.626,USD,大小和样式,SEI Investments Co.,SEI,No Underlying Index,活跃榜,净值,3464227.1891111117,USD
GPT,Intelligent Alpha Atlas ETF,NASDAQ,大盘,0.04671,USD,大小和样式,Empirical Finance LLC,Alpha,No Underlying Index,活跃榜,净值,3459484.5447577783,USD
VTWV,Vanguard Russell 2000 Value ETF,NASDAQ,小盘,2.868,USD,大小和样式,"The Vanguard Group, Inc.",Vanguard,Russell 2000 Value,价格,净值,3459442.5020488873,USD
GEM,Goldman Sachs ActiveBeta Emerging Markets Equity ETF,NYSE Arca,总市场,0.958,USD,大小和样式,"The Goldman Sachs Group, Inc.",Goldman Sachs,Stuttgart Goldman Sachs ActiveBeta EM Equity (USD),多因素,净值,3451477.1667688894,USD
CMDT,PIMCO Commodity Strategy Active Exchange-Traded Fund,NYSE Arca,广阔市场,0.84,USD,广阔市场,Allianz SE,PIMCO,No Underlying Index,活跃榜,商品,3444066.5324155563,USD
FLCH,Franklin FTSE China ETF,NYSE Arca,总市场,0.562,USD,大小和样式,"Franklin Resources, Inc.",Franklin,FTSE China RIC Capped Index,普通,净值,3441966.044123334,USD
MJ,Amplify Alternative Harvest ETF,NYSE Arca,主题,0.171505,USD,板块,Amplify Holding Co. LLC,Amplify,Prime Alternative Harvest Index,普通,净值,3439171.653397778,USD
IBHG,iShares iBonds 2027 Term High Yield and Income ETF,CBOE,高股息率,1.414,USD,企业，基础广泛,"BlackRock, Inc.",iShares,Bloomberg 2027 Term High Yield and Income Index - Benchmark TR Gross,子弹债券到期,固定收入,3436336.4787811115,USD
MINO,PIMCO Municipal Income Opportunities Active Exchange-Traded Fund,NYSE Arca,广泛信用,1.68,USD,政府、地方当局/市政府,Allianz SE,PIMCO,No Underlying Index,活跃榜,固定收入,3430051.42617,USD
ILOW,AB International Low Volatility Equity ETF,NYSE Arca,总市场,0.2646,USD,大小和样式,"Equitable Holdings, Inc.",AB Funds,No Underlying Index,活跃榜,净值,3429031.4902333347,USD
BSJS,Invesco BulletShares 2028 High Yield Corporate Bond ETF,NASDAQ,高股息率,1.415,USD,企业，基础广泛,Invesco Ltd.,Invesco,Invesco BulletShares High Yield Corporate Bond 2028 Index,子弹债券到期,固定收入,3427725.177862222,USD
PWV,Invesco Large Cap Value ETF,NYSE Arca,大盘,1.413,USD,大小和样式,Invesco Ltd.,Invesco,Dynamic Large Cap Value Intellidex Index (AMEX),价格,净值,3417307.3703855546,USD
YLD,Principal Active High Yield ETF,NYSE Arca,目标结果,1.392,USD,资产分配,"Principal Financial Group, Inc.",Principal,No Underlying Index,活跃榜,资产分配,3408067.6979755554,USD
TRUT,VanEck Technology TruSector ETF,NASDAQ,信息技术,0.0722,USD,板块,Van Eck Associates Corp.,VanEck,No Underlying Index,活跃榜,净值,3407435.9129600003,USD
ISHVF,iShares US Aggregate Bond UCITS ETF,OTC,投资等级,,,广阔市场，基础广泛,"BlackRock, Inc.",iShares,Bloomberg US Aggregate,普通,固定收入,3383880.157693333,USD
AIYY,YieldMax AI Option Income Strategy ETF,NYSE Arca,信息技术,28.773,USD,板块,Toroso Investments Topco LLC,YieldMax,No Underlying Index,买权,净值,3378918.268744444,USD
COLO,Global X MSCI Colombia ETF,NYSE Arca,总市场,2.677,USD,大小和样式,"Mirae Asset Global Investments Co., Ltd.",Global X,MSCI All Colombia Select 25/50,普通,净值,3373473.4596677762,USD
TDTF,FlexShares iBoxx 5 Year Target Duration TIPS Index Fund,NYSE Arca,投资等级,1.098,USD,政府，与通货膨胀挂钩,Northern Trust Corp.,FlexShares,iBoxx 5-Year Target Duration TIPS,目标持续时间,固定收入,3360956.1668444434,USD
SEIM,SEI Enhanced U.S. Large Cap Momentum Factor ETF,CBOE,大盘,0.257,USD,大小和样式,SEI Investments Co.,SEI,No Underlying Index,活跃榜,净值,3355108.217889999,USD
RXI,iShares Global Consumer Discretionary ETF,NYSE Arca,非必需消费品,3.014,USD,板块,"BlackRock, Inc.",iShares,S&P Global 1200 Consumer Discretionary (Sector) Capped Index (USD),普通,净值,3352628.73624111,USD
FEMB,First Trust Emerging Markets Local Currency Bond ETF,NASDAQ,广泛信用,1.7,USD,政府，财政部,AJM Ventures LLC,First Trust,No Underlying Index,活跃榜,固定收入,3344054.870167779,USD
SAMT,Strategas Macro Thematic Opportunities ETF,NYSE Arca,主题,0.27,USD,板块,"Baird Financial Group, Inc.",Strategas,No Underlying Index,活跃榜,净值,3343462.446956667,USD
AVNM,Avantis All International Markets Equity ETF,NYSE Arca,总市场,2.032,USD,大小和样式,"American Century Cos., Inc.",Avantis,No Underlying Index,活跃榜,净值,3331970.88559,USD
EDZ,Direxion Daily MSCI Emerging Markets Bear 3X Shares,NYSE Arca,总市场,2.344,USD,大小和样式,Rafferty Asset Management LLC,Direxion,MSCI EM (Emerging Markets),普通,净值,3310896.7740844446,USD
AVGU,GraniteShares 2x Long AVGO Daily ETF,NASDAQ,信息技术,,,板块,"GraniteShares, Inc.",GraniteShares,No Underlying Index,普通,净值,3310228.7442155564,USD
FNOV,FT Vest U.S. Equity Buffer ETF - November,CBOE,下行风险对冲,,,结构化结果,AJM Ventures LLC,FT Vest,No Underlying Index,买权,替代品,3304551.0340777775,USD
NTSX,WisdomTree U.S. Efficient Core Fund,NYSE Arca,目标结果,0.623,USD,资产分配,"WisdomTree, Inc.",WisdomTree,No Underlying Index,活跃榜,资产分配,3302903.387914444,USD
EPHE,iShares MSCI Philippines ETF,NYSE Arca,总市场,0.525,USD,大小和样式,"BlackRock, Inc.",iShares,MSCI Philippines IMI 25/50 Index,普通,净值,3282851.092666668,USD
UDN,Invesco DB US Dollar Index Bearish Fund,NYSE Arca,做多G10篮子，做空美元,0,USD,篮子,Invesco Ltd.,Invesco,Deutsche Bank Short USD Currency Portfolio Index,多因素,货币,3278217.0527455555,USD
RODM,Hartford Multifactor Developed Markets (ex-US) ETF,NYSE Arca,总市场,1.149,USD,大小和样式,"The Hartford Insurance Group, Inc.",Hartford,Hartford Risk-Optimized Multi Developed Markets Ex-US Index,多因素,净值,3272438.0295133335,USD
ONEY,State Street SPDR Russell 1000 Yield Focus ETF,NYSE Arca,大盘,3.58,USD,大小和样式,State Street Corp.,SPDR,Russell 1000 Yield Focused Factor Index,基本面,净值,3270482.1570799993,USD
GDEC,FT Vest U.S. Equity Moderate Buffer ETF - December,CBOE,下行风险对冲,,,结构化结果,AJM Ventures LLC,FT Vest,No Underlying Index,买权,替代品,3266550.376388889,USD
USPX,Franklin U.S. Equity Index ETF,NYSE Arca,总市场,0.41599,USD,大小和样式,"Franklin Resources, Inc.",Franklin,Morningstar US Target Market Exposure Index,普通,净值,3266479.509701111,USD
SUSB,iShares ESG Aware 1-5 Year USD Corporate Bond ETF,NASDAQ,投资等级,1.11,USD,企业，基础广泛,"BlackRock, Inc.",iShares,Bloomberg MSCI US Corporate ESG Focus (1-5 Y),ESG,固定收入,3261416.103401109,USD
WINN,Harbor Long-Term Growers ETF,NYSE,总市场,,,大小和样式,ORIX Corp.,Harbor,No Underlying Index,活跃榜,净值,3232626.9566188897,USD
AIS,VistaShares Artificial Intelligence Supercycle ETF,NYSE Arca,主题,,,板块,Toroso Investments Topco LLC,VistaShares,No Underlying Index,活跃榜,净值,3221392.947136666,USD
GPZ,VanEck Alternative Asset Manager ETF,NYSE Arca,财务指标,0.225,USD,板块,Van Eck Associates Corp.,VanEck,MarketVector Alternative Asset Managers Index - Benchmark TR Net,普通,净值,3220329.971673333,USD
HEGD,Swan Hedged Equity US Large Cap ETF,CBOE,大盘,0.09032,USD,大小和样式,Swan Global Holdings (US) LLC,Swan,No Underlying Index,活跃榜,净值,3212519.4993877774,USD
BWZ,SPDR Bloomberg Short Term International Treasury Bond ETF,NYSE Arca,投资等级,0.558,USD,政府，财政部,State Street Corp.,SPDR,Bloomberg Global Treasury (1-3 Y) Customized,普通,固定收入,3207071.3856344456,USD
KRMA,Global X Conscious Companies ETF,NASDAQ,总市场,1.126,USD,大小和样式,"Mirae Asset Global Investments Co., Ltd.",Global X,Concinnity Conscious Companies Index GTR Index,ESG,净值,3202771.0460155555,USD
RVNL,GraniteShares 2x Long RIVN Daily ETF,NASDAQ,非必需消费品,,,板块,"GraniteShares, Inc.",GraniteShares,No Underlying Index,普通,净值,3196322.94048,USD
KDEF,PLUS Korea Defense Industry Index ETF,NYSE Arca,工业,0.741,USD,板块,Cottonwood ETF Holdings LLC,PLUS,Korea Defense Industry Index - Benchmark TR Net,普通,净值,3187766.3501044447,USD
WEAT,Teucrium Wheat Fund,NYSE Arca,小麦,,,农业,Teucrium Trading LLC,Teucrium,Teucrium Wheat Fund Benchmark,阶梯式,商品,3178558.2373888884,USD
SEIE,SEI Select International Equity ETF,NASDAQ,总市场,0.746,USD,大小和样式,SEI Investments Co.,SEI,No Underlying Index,活跃榜,净值,3176558.761518888,USD
SFY,SoFi Select 500 ETF,NYSE Arca,大盘,1.267,USD,大小和样式,Toroso Investments Topco LLC,SoFi,Solactive SoFi US 500 Growth Index,成长,净值,3171327.1396499984,USD
DECW,AllianzIM U.S. Equity Buffer20 Dec ETF,CBOE,下行风险对冲,,,结构化结果,Allianz SE,Allianz,No Underlying Index,买权,替代品,3170464.0960655552,USD
IWMY,Defiance R2000 Weekly Distribution ETF,NYSE Arca,小盘,11.949,USD,大小和样式,Toroso Investments Topco LLC,Defiance,No Underlying Index,活跃榜,净值,3162701.5799666657,USD
GOOW,Roundhill GOOGL WeeklyPay ETF,CBOE,通讯服务,16.24,USD,板块,"Roundhill Financial, Inc.",Roundhill,No Underlying Index,普通,净值,3162085.568406666,USD
CERY,SPDR Bloomberg Enhanced Roll Yield Commodity Strategy No K-1 ETF,NYSE Arca,广阔市场,1.426,USD,广阔市场,State Street Corp.,SPDR,Bloomberg Enhanced Roll Yield Index - Benchmark TR Net,优化商品,商品,3160943.247613333,USD
ICLO,Invesco AAA CLO Floating Rate Note ETF,CBOE,投资等级,1.391,USD,企业，银行贷款,Invesco Ltd.,Invesco,No Underlying Index,活跃榜,固定收入,3160632.735586665,USD
SCUS,Schwab Ultra-Short Income ETF,NYSE Arca,投资等级,1.05,USD,广阔市场，基础广泛,The Charles Schwab Corp.,Schwab,No Underlying Index,活跃榜,固定收入,3156119.0628400003,USD
XVV,iShares ESG Select Screened S&P 500 ETF,CBOE,大盘,0.494,USD,大小和样式,"BlackRock, Inc.",iShares,S&P 500 Sustainability Screened Index,ESG,净值,3147998.44349,USD
TCAL,T. Rowe Price Capital Appreciation Premium Income ETF,NYSE Arca,总市场,2.668,USD,大小和样式,"T. Rowe Price Group, Inc.",T. Rowe Price,No Underlying Index,活跃榜,净值,3142446.8801666657,USD
PEJ,Invesco Leisure and Entertainment ETF,NYSE Arca,非必需消费品,0.147,USD,板块,Invesco Ltd.,Invesco,Dynamic Leisure & Entertainment Int Index (AMEX),多因素,净值,3140287.4502222226,USD
GOLY,Strategy Shares Gold Enhanced Yield ETF,CBOE,目标结果,2.576,USD,资产分配,"Rational Advisors, Inc.",Strategy Shares,No Underlying Index,活跃榜,资产分配,3124516.526833332,USD
SDVD,FT Vest SMID Rising Dividend Achievers Target Income ETF,CBOE,收入,1.791,USD,结构化结果,AJM Ventures LLC,FT Vest,No Underlying Index,活跃榜,替代品,3118317.908833331,USD
SNOU,T-REX 2X Long SNOW Daily Target ETF,CBOE,信息技术,2.492,USD,板块,Tuttle Capital Management LLC,T-Rex,"Snowflake, Inc.",普通,净值,3099846.8296266673,USD
IBCA,iShares iBonds Dec 2035 Term Corporate ETF,NYSE Arca,投资等级,1.104,USD,企业，基础广泛,"BlackRock, Inc.",iShares,Bloomberg December 2035 Maturity Corporate Index - Benchmark TR Gross,子弹债券到期,固定收入,3098610.3699155548,USD
IBTM,iShares iBonds Dec 2032 Term Treasury ETF,NASDAQ,投资等级,0.893,USD,政府，财政部,"BlackRock, Inc.",iShares,ICE 2032 Maturity US Treasury Index - Benchmark TR Gross,子弹债券到期,固定收入,3094959.4136344446,USD
DLLL,GraniteShares 2x Long DELL Daily ETF,NASDAQ,信息技术,,,板块,"GraniteShares, Inc.",GraniteShares,No Underlying Index,普通,净值,3092205.3940577763,USD
CNYA,iShares MSCI China A ETF,CBOE,总市场,0.663,USD,大小和样式,"BlackRock, Inc.",iShares,MSCI China A Inclusion Index,普通,净值,3083917.0141855553,USD
SRVR,Pacer Data & Infrastructure Real Estate ETF,NYSE Arca,房地产,0.77,USD,板块,"Pacer Advisors, Inc.",Pacer,Solactive GPR Data & Infrastructure Real Estate Index - Benchmark TR Gross,普通,净值,3083456.8368988885,USD
IQQQ,ProShares Nasdaq-100 High Income ETF,NASDAQ,大盘,4.6,USD,大小和样式,ProShare Advisors LLC,ProShares,Nasdaq-100 Daily Covered Call Index - Benchmark TR Gross,买权,净值,3069931.3036511117,USD
GXPT,Global X PureCap MSCI Information Technology ETF,NYSE Arca,信息技术,0.07501,USD,板块,"Mirae Asset Global Investments Co., Ltd.",Global X,MSCI USA Information Technology Index,普通,净值,3069335.668123333,USD
FDHY,Fidelity Enhanced High Yield ETF,NYSE Arca,高股息率,3.205,USD,企业，基础广泛,FMR LLC,Fidelity,No Underlying Index,活跃榜,固定收入,3064546.307906666,USD
FDEC,FT Vest US Equity Buffer ETF - December,CBOE,下行风险对冲,,,结构化结果,AJM Ventures LLC,FT Vest,No Underlying Index,买权,替代品,3052165.322024443,USD
GJUL,FT Vest U.S. Equity Moderate Buffer ETF - July,CBOE,下行风险对冲,,,结构化结果,AJM Ventures LLC,FT Vest,No Underlying Index,买权,替代品,3050348.3830655557,USD
CNEQ,Alger Concentrated Equity ETF,NYSE Arca,大盘,0,USD,大小和样式,"Alger Associates, Inc. (United States)",Alger,No Underlying Index,活跃榜,净值,3049068.987888887,USD
TDVG,T. Rowe Price Dividend Growth ETF,NYSE Arca,总市场,0.452,USD,大小和样式,"T. Rowe Price Group, Inc.",T. Rowe Price,No Underlying Index,活跃榜,净值,3033660.7893088884,USD
IGPT,Invesco AI and Next Gen Software ETF,NYSE Arca,信息技术,0.02641,USD,板块,Invesco Ltd.,Invesco,STOXX World AC NexGen Software Development Index - Benchmark TR Gross,基本面,净值,3031358.2452233336,USD
JVAL,JPMorgan U.S. Value Factor ETF US Value Factor Fund,NYSE Arca,大盘,1.022,USD,大小和样式,JPMorgan Chase & Co.,JPMorgan,JP Morgan US Value Factor Index,价格,净值,3030125.5708844448,USD
CLOX,Eldridge AAA CLO ETF,NYSE Arca,投资等级,1.321,USD,企业，银行贷款,NZC Capital LLC,Eldridge,No Underlying Index,活跃榜,固定收入,3028669.8439177773,USD
IXG,iShares Global Financials ETF,NYSE Arca,财务指标,2.467,USD,板块,"BlackRock, Inc.",iShares,S&P Global 1200 / Financials -SEC,普通,净值,3026491.9750466677,USD
PTNQ,Pacer Trendpilot 100 ETF,NASDAQ,大盘,0.305712,USD,大小和样式,"Pacer Advisors, Inc.",Pacer,Pacer NASDAQ-100 Trendpilot Index,波动性对冲,净值,3024446.4679977773,USD
TFLR,T. Rowe Price Floating Rate ETF,NYSE Arca,高股息率,3.543,USD,广阔市场，基础广泛,"T. Rowe Price Group, Inc.",T. Rowe Price,No Underlying Index,活跃榜,固定收入,3022886.1795844436,USD
HEWJ,iShares Currency Hedged MSCI Japan ETF,NYSE Arca,总市场,2.404,USD,大小和样式,"BlackRock, Inc.",iShares,MSCI Japan 100% Hedged to USD Net Variant,普通,净值,3021688.867394444,USD
QEFA,SPDR MSCI EAFE StrategicFactors ETF,NYSE Arca,总市场,2.834,USD,大小和样式,State Street Corp.,SPDR,MSCI EAFE Factor Mix A-Series (USD),多因素,净值,3018963.3233088893,USD
MUNY,Vanguard New York Tax-Exempt Bond ETF,CBOE,投资等级,3.184,USD,政府、地方当局/市政府,"The Vanguard Group, Inc.",Vanguard,S&P New York AMT-Free Municipal USD10 Million Par Bond Index - Benchmark TR Gross,普通,固定收入,3004696.8029977777,USD
SPEU,SPDR Portfolio Europe ETF,NYSE Arca,总市场,1.806,USD,大小和样式,State Street Corp.,SPDR,STOXX Europe TMI,普通,净值,3000959.7023077807,USD
CGUI,Capital Group Ultra Short Income ETF,NYSE Arca,投资等级,1.032,USD,广阔市场，基础广泛,"The Capital Group Cos., Inc.",Capital Group,No Underlying Index,活跃榜,固定收入,2999468.24224111,USD
ELIL,Direxion Daily LLY Bull 2X Shares,NASDAQ,卫生保健,0.436,USD,板块,Rafferty Asset Management LLC,Direxion,No Underlying Index,普通,净值,2990300.5651166686,USD
SBAR,Simplify Barrier Income ETF,NYSE Arca,总市场,3.36,USD,大小和样式,"Simplify Asset Management, Inc.",Simplify,No Underlying Index,活跃榜,净值,2989284.901466667,USD
EFAA,Invesco MSCI EAFE Income Advantage ETF,NYSE Arca,总市场,4.343,USD,大小和样式,Invesco Ltd.,Invesco,No Underlying Index,活跃榜,净值,2985914.5254,USD
TDAQ,TappAlpha Innovation 100 Growth & Daily Income ETF,CBOE,大盘,4.506,USD,大小和样式,"Tapp Finance, Inc.",TappAlpha,No Underlying Index,活跃榜,净值,2974625.4349444443,USD
DTD,WisdomTree U.S. Total Dividend Fund,NYSE Arca,总市场,1.693,USD,大小和样式,"WisdomTree, Inc.",WisdomTree,WisdomTree Dividend Index,股利,净值,2971520.9203,USD
FNDB,Schwab Fundamental U.S. Broad Market ETF,NYSE Arca,总市场,0.431,USD,大小和样式,The Charles Schwab Corp.,Schwab,RAFI Fundamental High Liquidity US All Index - Benchmark TR Gross,基本面,净值,2954779.6650171666,USD
IQDG,WisdomTree International Quality Dividend Growth Fund,CBOE,总市场,0.947,USD,大小和样式,"WisdomTree, Inc.",WisdomTree,WisdomTree International Quality Dividend Growth Index,多因素,净值,2954013.9678355553,USD
EWX,SPDR S&P Emerging Markets Small Cap ETF,NYSE Arca,小盘,1.908,USD,大小和样式,State Street Corp.,SPDR,S&P Emerging Markets <2B,普通,净值,2948434.0315522226,USD
JIG,JPMorgan International Growth ETF,NYSE Arca,总市场,1.65,USD,大小和样式,JPMorgan Chase & Co.,JPMorgan,No Underlying Index,活跃榜,净值,2946182.01842,USD
GFLW,VictoryShares Free Cash Flow Growth ETF,NASDAQ,大盘,0.006413,USD,大小和样式,"Victory Capital Holdings, Inc.",VictoryShares,Victory Free Cash Flow Growth Index,成长,净值,2944357.0386666674,USD
FDMO,Fidelity Momentum Factor ETF,NYSE Arca,总市场,0.514,USD,大小和样式,FMR LLC,Fidelity,Fidelity U.S. Momentum Factor Index,多因素,净值,2942308.5358522227,USD
VIXM,ProShares VIX Mid-Term Futures ETF,CBOE,波动率,,,战术工具,ProShare Advisors LLC,ProShares,S&P 500 VIX Mid-Term Futures Index,普通,替代品,2941271.6924111117,USD
TUSI,Touchstone Ultra Short Income ETF,CBOE,广泛信用,1.195,USD,广阔市场，基础广泛,Western & Southern Mutual Holding Co.,Touchstone,No Underlying Index,活跃榜,固定收入,2940778.960612223,USD
PNQI,Invesco NASDAQ Internet ETF,NASDAQ,主题,0.009,USD,板块,Invesco Ltd.,Invesco,NASDAQ Internet,普通,净值,2936303.495522223,USD
FTSD,Franklin Short Duration U.S. Government ETF,NYSE Arca,投资等级,4.249,USD,政府，基础广​​泛,"Franklin Resources, Inc.",Franklin,No Underlying Index,活跃榜,固定收入,2929327.141494445,USD
UTWO,US Treasury 2 Year Note ETF,NASDAQ,投资等级,1.736,USD,政府，财政部,"1251 Capital Group, Inc.",F/m,Bloomberg US Treasury Bellwether 2Y Index - Benchmark TR Gross,普通,固定收入,2928786.831313332,USD
BULG,Leverage Shares 2X Long BULL Daily ETF,NASDAQ,财务指标,,,板块,ETP Holding Co. LLC,Leverage Shares,No Underlying Index,普通,净值,2926567.7974744444,USD
PFEB,Innovator U.S. Equity Power Buffer ETF - February,CBOE,下行风险对冲,,,结构化结果,Innovator Capital Management LLC,Innovator,No Underlying Index,买权,替代品,2913255.9613944436,USD
USSG,Xtrackers MSCI USA Selection Equity ETF,NYSE Arca,总市场,0.648,USD,大小和样式,Deutsche Bank AG,Xtrackers,MSCI USA ESG Leaders,ESG,净值,2906697.865538889,USD
MGNR,American Beacon GLG Natural Resources ETF,NYSE Arca,主题,0.514,USD,板块,American Beacon Partners,American Beacon,No Underlying Index,活跃榜,净值,2902813.8512966656,USD
PJP,Invesco Pharmaceuticals ETF,NYSE Arca,卫生保健,1.022,USD,板块,Invesco Ltd.,Invesco,Dynamic Pharmaceutical Intellidex Index (AMEX),多因素,净值,2893882.2714022226,USD
XTL,State Street SPDR S&P Telecom ETF,NYSE Arca,主题,1.61,USD,板块,State Street Corp.,SPDR,S&P Telecom Select Industry,等于,净值,2892385.6825511125,USD
PCEF,Invesco CEF Income Composite ETF,NYSE Arca,目标结果,1.577,USD,资产分配,Invesco Ltd.,Invesco,SNET Composite Closed-End Fund Index,多因素,资产分配,2890800.941196667,USD
IPKW,Invesco International BuyBack Achievers ETF,NASDAQ,总市场,1.972,USD,大小和样式,Invesco Ltd.,Invesco,NASDAQ International BuyBack Achievers Index,基本面,净值,2889077.6271077776,USD
SSG,Proshares Ultrashort Semiconductors,NYSE Arca,信息技术,2.814,USD,板块,ProShare Advisors LLC,ProShares,DJ Global United States (All) / Semiconductors -SUB,普通,净值,2883449.326586665,USD
DUSA,Davis Select U.S. Equity ETF,CBOE,大盘,0.49,USD,大小和样式,Davis Selected Advisers LP,Davis,No Underlying Index,活跃榜,净值,2878731.6598100006,USD
DRV,Direxion Daily Real Estate Bear 3X Shares,NYSE Arca,房地产,0.764,USD,板块,Rafferty Asset Management LLC,Direxion,S&P Real Estate Select Sector,普通,净值,2874661.759466666,USD
QDEC,FT Vest Nasdaq-100 Buffer ETF - December,CBOE,下行风险对冲,,,结构化结果,AJM Ventures LLC,FT Vest,No Underlying Index,买权,替代品,2869566.5240100017,USD
FLCG,Federated Hermes MDT Large Cap Growth ETF,NYSE Arca,大盘,0.0157,USD,大小和样式,"Federated Hermes, Inc.",Federated Hermes,No Underlying Index,活跃榜,净值,2855707.827274444,USD
FLIA,Franklin International Aggregate Bond ETF,CBOE,广泛信用,0.529,USD,广阔市场，基础广泛,"Franklin Resources, Inc.",Franklin,No Underlying Index,活跃榜,固定收入,2852628.5230077775,USD
MRNY,YieldMax MRNA Option Income Strategy ETF,NYSE Arca,卫生保健,17.657,USD,板块,Toroso Investments Topco LLC,YieldMax,No Underlying Index,买权,净值,2850185.8903788896,USD
