商品代码,描述,交易所,焦点,指定年度股息,指定年度股息 - 货币,分类,发行人,品牌,指数追踪,策略,资产类别,价格 * 平均交易量 90天,价格 * 平均交易量 90天 - 货币
KEAT,Keating Active ETF,NASDAQ,总市场,0.756,USD,大小和样式,Empirical Finance LLC,Keating,No Underlying Index,活跃榜,净值,124634.89063444445,USD
TWOX,iShares Large Cap Accelerated Outcome ETF,CBOE,增强型增长,0.141,USD,结构化结果,"BlackRock, Inc.",iShares,No Underlying Index,买权,替代品,124586.12961222226,USD
BSTP,Innovator Buffer Step-Up Strategy ETF,NYSE Arca,下行风险对冲,,,结构化结果,Innovator Capital Management LLC,Innovator,No Underlying Index,买权,替代品,124575.2364711111,USD
KNRG,Simplify Kayne Anderson Energy and Infrastructure Credit ETF,NYSE Arca,广泛信用,1.845,USD,企业，基础广泛,"Simplify Asset Management, Inc.",Simplify,No Underlying Index,活跃榜,固定收入,124467.7780277778,USD
UTRE,US Treasury 3 Year Note ETF,NASDAQ,投资等级,1.779,USD,政府，财政部,"1251 Capital Group, Inc.",F/m,Bloomberg US Treasury Bellwether 3Y Index - Benchmark TR Gross,普通,固定收入,123018.3883888889,USD
XHYF,BondBloxx USD High Yield Bond Financial & REIT Sector ETF,NYSE Arca,高股息率,2.553,USD,企业，基础广泛,Bondbloxx Investment Management Corp.,BondBloxx,ICE Diversified US Cash Pay High Yield Financial & REIT,普通,固定收入,122886.41911222221,USD
DURA,VanEck Durable High Dividend ETF,CBOE,总市场,1.215,USD,大小和样式,Van Eck Associates Corp.,VanEck,Morningstar US Dividend Valuation Index,股利,净值,122669.74957444449,USD
DTEC,ALPS Disruptive Technologies ETF,NYSE Arca,主题,0.01798,USD,板块,"SS&C Technologies Holdings, Inc.",ALPS,Indxx Disruptive Technologies Index,多因素,净值,122647.20140555553,USD
SPXV,ProShares S&P 500 Ex-Health Care ETF,NYSE Arca,大盘,0.722,USD,大小和样式,ProShare Advisors LLC,ProShares,S&P 500 Ex-Health Care,普通,净值,122470.34075888892,USD
XAIXF,Xtrackers Artificial Intelligence & Big Data UCITS ETF,OTC,主题,,,板块,Deutsche Bank AG,Xtrackers,Nasdaq Yewno Global AI and Big Data Index,普通,净值,122191.29280555558,USD
PQJL,PGIM Nasdaq-100 Buffer 12 ETF - July,NASDAQ,下行风险对冲,0.00171,USD,结构化结果,"Prudential Financial, Inc.",PGIM,No Underlying Index,买权,替代品,121748.16319111116,USD
EEMO,Invesco S&P Emerging Markets Momentum ETF,NYSE Arca,总市场,0.405,USD,大小和样式,Invesco Ltd.,Invesco,S&P Momentum Emerging Plus LargeMidCap Index,动量,净值,121658.47280777775,USD
ALIL,Argent Focused Small Cap ETF,NASDAQ,小盘,0.067955,USD,大小和样式,Empirical Finance LLC,Argent,No Underlying Index,活跃榜,净值,121632.32193777777,USD
DSPY,Tema S&P 500 Historical Weight ETF Strategy,NYSE Arca,大盘,0.554,USD,大小和样式,Dawn Global Topco Ltd.,Tema,No Underlying Index,活跃榜,净值,121628.94583111108,USD
ARCM,Arrow Reserve Capital Management ETF,CBOE,投资等级,4.024,USD,广阔市场，基础广泛,Arrow Investment Advisors LLC,ArrowShares,No Underlying Index,活跃榜,固定收入,121623.02834444444,USD
PSFD,Pacer Swan SOS Flex (January) ETF,CBOE,下行风险对冲,,,结构化结果,"Pacer Advisors, Inc.",Pacer,No Underlying Index,买权,替代品,121012.56569666661,USD
TAXM,BondBloxx IR+M Tax-Aware ETF for Massachusetts Residents,NYSE Arca,投资等级,1.845,USD,政府、地方当局/市政府,Bondbloxx Investment Management Corp.,BondBloxx,No Underlying Index,活跃榜,固定收入,120892.83827222223,USD
USSH,WisdomTree 1-3 Year Laddered Treasury Fund,NASDAQ,投资等级,1.809,USD,政府，财政部,"WisdomTree, Inc.",WisdomTree,Bloomberg US Treasury 1-3 Year Laddered Index - Benchmark TR Gross,等于,固定收入,120718.73703555553,USD
PBSE,PGIM S&P 500 Buffer 20 ETF - September,CBOE,下行风险对冲,,,结构化结果,"Prudential Financial, Inc.",PGIM,No Underlying Index,买权,替代品,120336.46524222221,USD
DYLG,Global X Dow 30 Covered Call & Growth ETF,NYSE Arca,大盘,1.175,USD,大小和样式,"Mirae Asset Global Investments Co., Ltd.",Global X,Cboe DJIA Half BuyWrite Index - Benchmark TR Gross,买权,净值,120229.48370444452,USD
TDEC,FT Vest Emerging Markets Buffer ETF - December,CBOE,下行风险对冲,,,结构化结果,AJM Ventures LLC,FT Vest,No Underlying Index,买权,替代品,119501.19761999989,USD
SHPP,Pacer Industrials and Logistics ETF,NYSE Arca,工业,0.466,USD,板块,"Pacer Advisors, Inc.",Pacer,Pacer Global Supply Chain Infrastructure Index - Benchmark TR Net,普通,净值,119467.58609777782,USD
ISRNF,iShares S&P 500 Consumer Discretionary Sector UCITS ETF,OTC,非必需消费品,,,板块,"BlackRock, Inc.",iShares,S&P 500 CAPPED 35/20 CONSUMER DISCRETIONARY  NTR,普通,净值,118964.37562666666,USD
AETH,Bitwise Trendwise Ether and Treasuries Rotation Strategy ETF,NYSE Arca,做多以太币，做空美元,0.87,USD,对,"Bitwise Asset Management, Inc.",Bitwise,No Underlying Index,普通,货币,118914.99126111108,USD
BBSB,JPMorgan BetaBuilders U.S. Treasury Bond 1-3 Year ETF,CBOE,投资等级,3.66,USD,政府，财政部,JPMorgan Chase & Co.,JPMorgan,ICE BofA US Treasury Bond (1-3 Y),普通,固定收入,118848.0249822223,USD
IHSXF,iShares MSCI North America UCITS ETF,OTC,总市场,0.8421238337000001,USD,大小和样式,"BlackRock, Inc.",iShares,MSCI North America,普通,净值,118691.83415111109,USD
TXS,Texas Capital Texas Equity Index ETF,NYSE Arca,总市场,0.29,USD,大小和样式,"Texas Capital Bancshares, Inc.",Texas Capital,Texas Capital Texas Equity Index - Benchmark TR Gross,普通,净值,118366.48553555556,USD
ROMO,Strategy Shares Newfound/ReSolve Robust Momentum ETF,CBOE,目标结果,0.794,USD,资产分配,"Rational Advisors, Inc.",Strategy Shares,Newfound/ReSolve Robust Equity Momentum Index,动量,资产分配,118278.17565555565,USD
TPLS,Thornburg Core Plus Bond ETF,NASDAQ,广泛信用,1.103,USD,广阔市场，基础广泛,"Thornburg Investment Management, Inc.",Thornburg,No Underlying Index,活跃榜,固定收入,118128.87385333338,USD
CDEI,"Calvert US Large-Cap Diversity, Equity and Inclusion Index ETF",NYSE Arca,大盘,0.87,USD,大小和样式,Morgan Stanley,Calvert,Calvert US Large-Cap Diversity Research Index - Benchmark TR Gross,ESG,净值,117277.9872677778,USD
LCOW,Pacer S&P 500 Quality FCF Aristocrats ETF,CBOE,大盘,0.136,USD,大小和样式,"Pacer Advisors, Inc.",Pacer,S&P 500 Quality FCF Aristocrats Index - Benchmark TR Gross,基本面,净值,116962.7693244445,USD
AUGM,FT Vest U.S. Equity Max Buffer ETF - August,CBOE,下行风险对冲,,,结构化结果,AJM Ventures LLC,FT Vest,No Underlying Index,领口期权,替代品,116905.90246888889,USD
IIGD,Invesco Investment Grade Defensive ETF,NYSE Arca,投资等级,1.057,USD,企业，基础广泛,Invesco Ltd.,Invesco,Invesco Investment Grade Defensive Index,基本面,固定收入,116752.19471222222,USD
GTR,WisdomTree Target Range Fund,NASDAQ,总市场,0.602,USD,大小和样式,"WisdomTree, Inc.",WisdomTree,No Underlying Index,活跃榜,净值,116560.51177111115,USD
JUSA,JPMorgan U.S. Research Enhanced Large Cap ETF,NYSE Arca,大盘,0.593,USD,大小和样式,JPMorgan Chase & Co.,JPMorgan,No Underlying Index,活跃榜,净值,116193.00412666665,USD
LOPP,Gabelli Love Our Planet & People ETF,NYSE Arca,总市场,0.274,USD,大小和样式,"GAMCO Investors, Inc.",Gabelli,No Underlying Index,活跃榜,净值,115920.23111888886,USD
IIXFF,iShares Global Govt Bond UCITS ETF Accum USD,OTC,投资等级,,,政府，财政部,"BlackRock, Inc.",iShares,FTSE G7 Government Bond Index,普通,固定收入,115856.17889666671,USD
SPXE,ProShares S&P 500 Ex-Energy ETF,NYSE Arca,大盘,0.732,USD,大小和样式,ProShare Advisors LLC,ProShares,S&P 500 Ex-Energy,普通,净值,115528.69233111115,USD
LOGO,Alpha Brands Consumption Leaders ETF,NASDAQ,主题,,,板块,Toroso Investments Topco LLC,Alpha Brands,No Underlying Index,活跃榜,净值,115525.30566888886,USD
SMHB,ETRACS 2xMonthly Pay Leveraged US Small Cap High Dividend ETN Series B,NYSE Arca,小盘,0.966,USD,大小和样式,UBS Group AG,ETRACS,Solactive US Small Cap High Dividend Index,股利,净值,115458.21186000002,USD
FGSM,Frontier Asset Global Small Cap Equity ETF,NYSE Arca,小盘,0.47,USD,大小和样式,Frontier Asset Management LLC,Frontier,No Underlying Index,活跃榜,净值,115360.50430000004,USD
CEFA,Global X S&P Catholic Values Developed ex-US ETF,NASDAQ,大盘,1.055,USD,大小和样式,"Mirae Asset Global Investments Co., Ltd.",Global X,S&P Developed Ex-U.S. Catholic Values Index,ESG,净值,115195.77544222215,USD
XTJA,Innovator U.S. Equity Accelerated Plus ETF - January,CBOE,增强型增长,,,结构化结果,Innovator Capital Management LLC,Innovator,No Underlying Index,买权,替代品,114950.18193888884,USD
PJIO,PGIM Jennison International Opportunities ETF,NYSE Arca,总市场,0.117,USD,大小和样式,"Prudential Financial, Inc.",PGIM,No Underlying Index,活跃榜,净值,114889.47151333332,USD
XRLV,Invesco S&P 500 ex-Rate Sensitive Low Volatility ETF,NYSE Arca,大盘,0,USD,大小和样式,Invesco Ltd.,Invesco,S&P 500 Low Volatility Rate Response Index,技术,净值,114786.35887777779,USD
WGQDF,WisdomTree Global Quality Dividend Growth UCITS ETF USD Acc,OTC,总市场,,,大小和样式,"WisdomTree, Inc.",WisdomTree,WisdomTree Global Developed Quality Dividend Growth Index - USD,多因素,净值,114474.27342000004,USD
HAUS,Residential REIT ETF,CBOE,房地产,0.785,USD,板块,Toroso Investments Topco LLC,Armada ETF Advisors,No Underlying Index,活跃榜,净值,113933.85914111108,USD
CVY,Invesco Zacks Multi-Asset Income ETF,NYSE Arca,目标结果,1.071,USD,资产分配,Invesco Ltd.,Invesco,Zacks Multi-Asset Income (TR),多因素,资产分配,113495.86469666666,USD
IUQFF,iShares Edge MSCI USA Quality Factor UCITS ETF,OTC,总市场,,,大小和样式,"BlackRock, Inc.",iShares,MSCI USA Sector Neutral Quality,基本面,净值,113398.43380444439,USD
LOCT,Innovator Premium Income 15 Buffer ETF - October,CBOE,收入,1.224,USD,结构化结果,Innovator Capital Management LLC,Innovator,No Underlying Index,买权,替代品,113304.91922888892,USD
EVLU,iShares MSCI Emerging Markets Value Factor ETF,CBOE,总市场,1.668,USD,大小和样式,"BlackRock, Inc.",iShares,MSCI Emerging Markets Value Factor Select Index - Benchmark TR Net,价格,净值,113254.95706111108,USD
DEFI,Hashdex Bitcoin ETF,NYSE Arca,做多比特币，做空美元,,,对,Toroso Investments Topco LLC,Hashdex,Nasdaq Bitcoin Settlement Price,普通,货币,113109.8210411111,USD
SSEHF,SSgA SPDR ETFs Europe II Plc - S&P US Health Care Sel. Sec.,OTC,卫生保健,,,板块,State Street Corp.,SPDR,S&P Health Care Select Sector Daily Capped 25/20 Index,普通,净值,113042.76985444443,USD
LDRI,iShares iBonds 1-5 Year TIPS Ladder ETF,NYSE Arca,投资等级,1.053,USD,政府，与通货膨胀挂钩,"BlackRock, Inc.",iShares,BlackRock iBonds 1-5 Year TIPS Ladder Index - Benchmark TR Gross,等于,固定收入,112999.95014555551,USD
PSCM,Invesco S&P SmallCap Materials ETF,NASDAQ,材料,0.986,USD,板块,Invesco Ltd.,Invesco,S&P Small Cap 600 / Materials -SEC,普通,净值,112919.93528666667,USD
JCHI,JPMorgan Active China ETF Active China ETF,NYSE Arca,总市场,0.991,USD,大小和样式,JPMorgan Chase & Co.,JPMorgan,No Underlying Index,活跃榜,净值,112642.11665111114,USD
CAFG,Pacer US Small Cap Cash Cows Growth Leaders ETF,NASDAQ,小盘,0.08862,USD,大小和样式,"Pacer Advisors, Inc.",Pacer,Pacer US Small Cap Cash Cows Growth Leaders Index - Benchmark TR Gross,成长,净值,112364.06916111118,USD
PSCF,Invesco S&P SmallCap Financials ETF,NASDAQ,财务指标,1.203,USD,板块,Invesco Ltd.,Invesco,S&P SmallCap 600 Capped Financials & Real Estate Index,普通,净值,112296.28556111109,USD
MCH,Matthews China Active ETF,NYSE Arca,总市场,0.497,USD,大小和样式,Matthews International Capital Management LLC,Matthews,No Underlying Index,活跃榜,净值,112211.81525555559,USD
SSGXF,SSgA SPDR ETFs Europe II Plc - S&P US Industrial Select Sector,OTC,工业,,,板块,State Street Corp.,SPDR,S&P Industrials Select Sector Daily Capped 25/20 Index,普通,净值,112014.75466222221,USD
IREMF,iShares MSCI EM UCITS ETF USD (Dist),OTC,总市场,1.009363752,USD,大小和样式,"BlackRock, Inc.",iShares,MSCI EM (Emerging Markets),普通,净值,111789.93640000002,USD
PEX,ProShares Global Listed Private Equity ETF,CBOE,财务指标,3.163,USD,板块,ProShare Advisors LLC,ProShares,LPX Direct Listed Private Equity Index,普通,净值,111396.60394111113,USD
BKCG,BNY Mellon Concentrated Growth ETF,NYSE Arca,大盘,0.217,USD,大小和样式,The Bank of New York Mellon Corp.,BNY Mellon,No Underlying Index,活跃榜,净值,111195.97936444446,USD
GURU,Global X Guru Index ETF,NYSE Arca,总市场,0.07116,USD,大小和样式,"Mirae Asset Global Investments Co., Ltd.",Global X,Solactive Guru Index,抄袭,净值,110717.03077000001,USD
FEIG,FlexShares ESG & Climate Investment Grade Corporate Core Index Fund,NYSE Arca,投资等级,1.993,USD,企业，基础广泛,Northern Trust Corp.,FlexShares,Northern Trust ESG & Climate Investment Grade U.S. Corporate Core TR,ESG,固定收入,110644.55828666667,USD
CCSO,Carbon Collective Climate Solutions U.S. Equity ETF,NASDAQ,主题,0.156,USD,板块,Toroso Investments Topco LLC,Carbon Collective,No Underlying Index,活跃榜,净值,110446.73254000003,USD
USVN,US Treasury 7 Year Note ETF,NASDAQ,投资等级,1.828,USD,政府，财政部,"1251 Capital Group, Inc.",US Benchmark Series,Bloomberg US Treasury Bellwether 7Y Index - Benchmark TR Gross,普通,固定收入,110387.64467555551,USD
STXM,Strive Mid-Cap ETF,NYSE,中盘,0.325,USD,大小和样式,Empirical Finance LLC,Strive,Bloomberg US 400 Index - Benchmark TR Gross,普通,净值,110351.30782826671,USD
AZYY,GraniteShares YieldBoost AMZN ETF,NASDAQ,非必需消费品,4.208,USD,板块,"GraniteShares, Inc.",GraniteShares,No Underlying Index,买权,净值,110230.4838211112,USD
DDX,Defined Duration 10 ETF,CBOE,目标结果,0.766,USD,资产分配,Empirical Finance LLC,Discipline Funds,No Underlying Index,活跃榜,资产分配,110215.26021444444,USD
HOMZ,Hoya Capital Housing ETF,NYSE Arca,主题,1.161,USD,板块,"Pettee Investors, Inc.",Hoya,Hoya Capital Housing 100 Index,基本面,净值,110211.12617333332,USD
LDEM,iShares ESG MSCI EM Leaders ETF,NASDAQ,总市场,0.476751,USD,大小和样式,"BlackRock, Inc.",iShares,MSCI EM Extended ESG Leaders Index,ESG,净值,110149.4235455556,USD
FLXN,Horizon Flexible Income ETF,CBOE,高股息率,1.538,USD,广阔市场，基础广泛,ACP Horizon Holdings LP,Horizon,No Underlying Index,活跃榜,固定收入,109923.51686222218,USD
STNC,Hennessy Sustainable ETF,NASDAQ,总市场,0.337,USD,大小和样式,"Hennessy Advisors, Inc.",Hennessy,No Underlying Index,活跃榜,净值,109186.85522555554,USD
PBFB,PGIM S&P 500 Buffer 20 ETF - February,CBOE,下行风险对冲,,,结构化结果,"Prudential Financial, Inc.",PGIM,No Underlying Index,买权,替代品,108991.05539333336,USD
MFSM,MFS Active Intermediate Muni Bond ETF,NYSE,广泛信用,0.889,USD,政府、地方当局/市政府,"Sun Life Financial, Inc.",MFS,No Underlying Index,活跃榜,固定收入,108823.08994888896,USD
INRO,iShares U.S. Industry Rotation Active ETF,NASDAQ,总市场,0.219,USD,大小和样式,"BlackRock, Inc.",iShares,No Underlying Index,活跃榜,净值,107351.92764888886,USD
IMKXF,Invesco Preferred Shares UCITS ETF,OTC,广泛信用,0.7988,USD,企业，首选,Invesco Ltd.,Invesco,ICE BofA Diversified Core Plus Fixed Rate Preferred Securities Index,普通,固定收入,107037.27295666664,USD
KJUN,Innovator U.S. Small Cap Power Buffer ETF - June,CBOE,下行风险对冲,,,结构化结果,Innovator Capital Management LLC,Innovator,No Underlying Index,买权,替代品,106998.50729666669,USD
HCOW,Amplify COWS Covered Call ETF,NASDAQ,总市场,2.703,USD,大小和样式,Amplify Holding Co. LLC,Amplify,No Underlying Index,活跃榜,净值,106854.0000188889,USD
BILT,iShares Infrastructure Active ETF,CBOE,主题,0.513,USD,板块,"BlackRock, Inc.",iShares,No Underlying Index,活跃榜,净值,106746.49529222217,USD
DRUP,GraniteShares Nasdaq Select Disruptors ETF,NYSE Arca,大盘,,,大小和样式,"GraniteShares, Inc.",GraniteShares,Nasdaq US Large Cap Select Disruptors Index - Benchmark TR Gross,基本面,净值,106587.36327222217,USD
ASIA,Matthews Pacific Tiger Active ETF,NYSE Arca,总市场,0.357,USD,大小和样式,Matthews International Capital Management LLC,Matthews,No Underlying Index,活跃榜,净值,106582.78778777776,USD
XHYC,BondBloxx USD High Yield Bond Consumer Cyclicals Sector ETF,NYSE Arca,高股息率,2.478,USD,企业，基础广泛,Bondbloxx Investment Management Corp.,BondBloxx,ICE Diversified US Cash Pay High Yield Consumer Cyclical Index,普通,固定收入,106406.96195444441,USD
ZTOP,F/m High Yield 100 ETF,NASDAQ,高股息率,2.91,USD,企业，基础广泛,"1251 Capital Group, Inc.",F/m,Bloomberg U.S. High Yield Top 100 Quality Select Equal Weighted Index - Benchmark TR Gross,等于,固定收入,106139.4614766667,USD
SXQG,ETC 6 Meridian Quality Growth ETF,NYSE Arca,总市场,0.005098,USD,大小和样式,Cottonwood ETF Holdings LLC,Meridian,No Underlying Index,活跃榜,净值,105818.57050555553,USD
MYMH,State Street My2028 Municipal Bond ETF,NASDAQ,投资等级,0.741,USD,政府、地方当局/市政府,State Street Corp.,State Street,No Underlying Index,活跃榜,固定收入,105768.11516333332,USD
RNRG,Global X Renewable Energy Producers ETF,NASDAQ,主题,0.5,USD,板块,"Mirae Asset Global Investments Co., Ltd.",Global X,Indxx Renewable Energy Producers Index,普通,净值,105708.30426666666,USD
GCAD,Gabelli Commercial Aerospace and Defense ETF,NYSE Arca,工业,0.387,USD,板块,"GAMCO Investors, Inc.",Gabelli,No Underlying Index,活跃榜,净值,105514.45015888891,USD
FOWF,Pacer Solactive Whitney Future of Warfare ETF,CBOE,主题,0.247,USD,板块,"Pacer Advisors, Inc.",Pacer,Solactive Whitney Future of Warfare Index - Benchmark TR Gross,基本面,净值,105295.74494222229,USD
NXTI,Simplify Next Intangible Core Index ETF,CBOE,总市场,0.203,USD,大小和样式,"Simplify Asset Management, Inc.",Simplify,Next Intangible Core Index - Benchmark TR Gross,价格,净值,105235.72388666667,USD
DAT,ProShares Big Data Refiners ETF,NYSE Arca,信息技术,,,板块,ProShare Advisors LLC,ProShares,FactSet Big Data Refiners Index,普通,净值,105080.14864333338,USD
EHLS,Even Herd Long Short ETF,NASDAQ,多/空,0,USD,对冲基金策略,Toroso Investments Topco LLC,Even Herd,No Underlying Index,活跃榜,替代品,105070.00733111112,USD
ISCBF,iShares Global High Yield Corp Bond UCITS ETF Accum USD,OTC,高股息率,,,企业，基础广泛,"BlackRock, Inc.",iShares,Markit iBoxx Global Developed Markets Liquid High Yield Capped Index,普通,固定收入,104681.61363444442,USD
UPGD,Invesco Bloomberg Analyst Rating Improvers ETF,NYSE Arca,总市场,1.293,USD,大小和样式,Invesco Ltd.,Invesco,Bloomberg ANR Improvers Index,基本面,净值,104646.57061666664,USD
DALI,First Trust Dorsey Wright DALI Equity ETF,NASDAQ,总市场,0.11,USD,大小和样式,AJM Ventures LLC,First Trust,Nasdaq Dorsey Wright DALI Equity Index,动量,净值,104409.36593222225,USD
FLOW,Global X U.S. Cash Flow Kings 100 ETF,NYSE Arca,总市场,0.774,USD,大小和样式,"Mirae Asset Global Investments Co., Ltd.",Global X,Global X U.S. Cash Flow Kings 100 Index - Benchmark TR Gross,基本面,净值,104237.48784333334,USD
CPSY,Calamos S&P 500 Structured Alt Protection ETF January,NYSE Arca,下行风险对冲,,,结构化结果,"Calamos Family Partners, Inc.",Calamos,No Underlying Index,领口期权,替代品,104181.54267222228,USD
BSJX,Invesco BulletShares 2033 High Yield Corporate Bond ETF,NASDAQ,高股息率,1.84,USD,企业，基础广泛,Invesco Ltd.,Invesco,Invesco BulletShares USD High Yield Corporate Bond 2033 Index - Benchmark TR Gross,子弹债券到期,固定收入,104069.75550666664,USD
MARU,AllianzIM U.S. Equity Buffer15 Uncapped Mar ETF,CBOE,增强型增长,,,结构化结果,Allianz SE,Allianz,No Underlying Index,买权,替代品,104053.81888000005,USD
RINF,ProShares Inflation Expectations ETF,NYSE Arca,价差图表,1.254,USD,战术工具,ProShare Advisors LLC,ProShares,FTSE 30-Year TIPS (Treasury Rate-Hedged) Index,久期对冲,替代品,103810.41868666663,USD
PALD,Direxion Daily PANW Bear 1X Shares,NASDAQ,信息技术,0.787,USD,板块,Rafferty Asset Management LLC,Direxion,"Palo Alto Networks, Inc.",普通,净值,103771.98519888893,USD
DUKH,Ocean Park High Income ETF,NASDAQ,高股息率,1.492,USD,广阔市场，基础广泛,Ocean Park Asset Management LLC,Ocean Park,No Underlying Index,活跃榜,固定收入,103540.77075888889,USD
JABS,Janus Henderson Asset-Backed Securities ETF,NYSE Arca,投资等级,2.498,USD,广阔市场，资产支持,Janus Henderson Group Plc,Janus Henderson,No Underlying Index,活跃榜,固定收入,103437.57104000004,USD
CEFZ,RiverNorth Active Income ETF,CBOE,目标结果,0.822,USD,资产分配,RiverNorth Holding Co.,RiverNorth,No Underlying Index,活跃榜,资产分配,103377.9491322221,USD
XIDE,FT Vest U.S. Equity Buffer & Premium Income ETF - December,CBOE,收入,1.964,USD,结构化结果,AJM Ventures LLC,FT Vest,No Underlying Index,买权,替代品,103345.6430511111,USD
NRGD,MicroSectors U.S. Big Oil -3 Inverse Leveraged ETN,NYSE Arca,能源,,,板块,Bank of Montreal,REX Microsectors,Solactive MicroSectors U.S. Big Oil Index,等于,净值,103317.00044000003,USD
EMSF,Matthews Emerging Markets Sustainable Future Active ETF,NYSE Arca,总市场,1.922,USD,大小和样式,Matthews International Capital Management LLC,Matthews,No Underlying Index,活跃榜,净值,103294.29212888889,USD
ISSZF,iShares S&P 500 Utilities Sector UCITS ETF,OTC,公用事业,,,板块,"BlackRock, Inc.",iShares,S&P 500 Capped 35/20 Utilities Sector Index,普通,净值,102977.36454777783,USD
IVRA,Invesco Real Assets ESG ETF,CBOE,总市场,0,USD,大小和样式,Invesco Ltd.,Invesco,No Underlying Index,活跃榜,净值,102891.6170588889,USD
BYRE,Principal Real Estate Active Opportunities ETF,NYSE Arca,房地产,0.663,USD,板块,"Principal Financial Group, Inc.",Principal,No Underlying Index,活跃榜,净值,102367.7167822223,USD
MYCI,State Street My2029 Corporate Bond ETF,NASDAQ,投资等级,1.141,USD,企业，基础广泛,State Street Corp.,State Street,No Underlying Index,活跃榜,固定收入,102338.23908888883,USD
LDRX,SGI Enhanced Market Leaders ETF,NASDAQ,大盘,0.274,USD,大小和样式,Summit Global LLC,Summit Global Investments,No Underlying Index,活跃榜,净值,102231.98175333331,USD
DTAN,Sparkline International Intangible Value ETF,NYSE Arca,总市场,0.494,USD,大小和样式,Empirical Finance LLC,Sparkline,No Underlying Index,活跃榜,净值,101959.29982333332,USD
SYZ,Lazard US Systematic Small Cap Equity ETF,NASDAQ,小盘,,,大小和样式,"Lazard, Inc.",Lazard,No Underlying Index,活跃榜,净值,101947.9219311111,USD
FFDI,Fidelity Fundamental Developed International ETF,CBOE,总市场,0.652,USD,大小和样式,FMR LLC,Fidelity,No Underlying Index,活跃榜,净值,101698.79269777778,USD
DKUP,T-REX 2X Long DKNG Daily Target ETF,CBOE,非必需消费品,,,板块,Tuttle Capital Management LLC,T-Rex,No Underlying Index,普通,净值,101585.89016333332,USD
AGQI,First Trust Active Global Quality Income ETF -VIII-,NYSE Arca,总市场,0.419,USD,大小和样式,AJM Ventures LLC,First Trust,No Underlying Index,活跃榜,净值,101539.01226444443,USD
MSTI,Madison Short Term Strategic Income ETF,NYSE Arca,广泛信用,1.045,USD,广阔市场，基础广泛,"Madison Investment Holdings, Inc.",Madison,No Underlying Index,活跃榜,固定收入,101351.4982288889,USD
RILA,Indexperts Gorilla Aggressive Growth ETF,NYSE Arca,总市场,0.0088,USD,大小和样式,Indexperts LLC,Indexperts,No Underlying Index,活跃榜,净值,101265.5444833333,USD
FTDS,First Trust Dividend Strength ETF,NASDAQ,总市场,0.9,USD,大小和样式,AJM Ventures LLC,First Trust,The Dividend Strength Index,基本面,净值,101161.18049555556,USD
BJK,VanEck Gaming ETF,NASDAQ,非必需消费品,1.364,USD,板块,Van Eck Associates Corp.,VanEck,MVIS Global Gaming,普通,净值,101064.34347333334,USD
MNBD,ALPS Intermediate Municipal Bond ETF,NYSE Arca,投资等级,0.857,USD,政府、地方当局/市政府,"SS&C Technologies Holdings, Inc.",ALPS,No Underlying Index,活跃榜,固定收入,100942.6976311111,USD
QRMI,Global X NASDAQ 100 Risk Managed Income ETF,NASDAQ,大盘,2.056,USD,大小和样式,"Mirae Asset Global Investments Co., Ltd.",Global X,NASDAQ-100 Monthly Net Credit Collar 95-100 Index,领口期权,净值,100911.82871000003,USD
FRDU,Direxion Daily F Bull 2X ETF,NASDAQ,非必需消费品,0.512,USD,板块,Rafferty Asset Management LLC,Direxion,Ford Motor Company - Benchmark Price Return,普通,净值,100828.24314999997,USD
WTTHF,SPDR MSCI World Technology UCITS ETF,OTC,信息技术,,,板块,State Street Corp.,SPDR,MSCI World Information Technology 35/20 Capped Index - Benchmark TR Net,普通,净值,100589.24254777779,USD
SWOOF,SPDR MSCI World Health Care UCITS ETF,OTC,卫生保健,,,板块,State Street Corp.,SPDR,MSCI World Health Care 35/20 Capped Index - Benchmark TR Net,普通,净值,100257.1041944445,USD
FTAG,First Trust Indxx Global Agriculture ETF,NASDAQ,主题,0.366,USD,板块,AJM Ventures LLC,First Trust,Indxx Global Agriculture Index,普通,净值,99828.89323333332,USD
BNGE,First Trust S-Network Streaming and Gaming ETF,NYSE Arca,主题,0.333,USD,板块,AJM Ventures LLC,First Trust,S-Network Streaming & Gaming Index - Benchmark TR Net,普通,净值,99785.56130333332,USD
CLCV,Crossmark Large Cap Value ETF,NYSE Arca,大盘,0.106,USD,大小和样式,AG Financial Services Group,Crossmark,No Underlying Index,活跃榜,净值,99753.4260144444,USD
TMED,T. Rowe Price Health Care ETF,NASDAQ,卫生保健,0.162,USD,板块,"T. Rowe Price Group, Inc.",T. Rowe Price,No Underlying Index,活跃榜,净值,99736.53540555554,USD
