商品代码,描述,交易所,焦点,指定年度股息,指定年度股息 - 货币,分类,发行人,品牌,指数追踪,策略,资产类别,价格 * 平均交易量 90天,价格 * 平均交易量 90天 - 货币
ISUDF,iShares USD Ultrashort Bond UCITS ETF,OTC,投资等级,,,企业，基础广泛,"BlackRock, Inc.",iShares,Markit iBoxx USD Liquid Investment Grade Ultrashort Index,普通,固定收入,639643.7124177779,USD
FSZ,First Trust Switzerland AlphaDEX Fund,NASDAQ,总市场,1.438,USD,大小和样式,AJM Ventures LLC,First Trust,NASDAQ AlphaDEX Switzerland Index,多因素,净值,637631.8418299999,USD
FDCF,Fidelity Disruptive Communications ETF,NASDAQ,主题,0.016,USD,板块,FMR LLC,Fidelity,No Underlying Index,活跃榜,净值,637214.4904799996,USD
FLEE,Franklin FTSE Europe ETF,NYSE Arca,总市场,1.008,USD,大小和样式,"Franklin Resources, Inc.",Franklin,FTSE Developed Europe RIC Capped Index,普通,净值,636972.971267778,USD
LDRC,iShares iBonds 1-5 Year Corporate Ladder ETF,NYSE Arca,投资等级,1.124,USD,企业，基础广泛,"BlackRock, Inc.",iShares,BlackRock iBonds 1-5 Year Corporate Ladder Index - Benchmark TR Gross,等于,固定收入,636694.817012222,USD
SNSR,Global X Internet of Things ETF,NASDAQ,主题,0.2,USD,板块,"Mirae Asset Global Investments Co., Ltd.",Global X,Indxx Global Internet of Things Thematic Index,普通,净值,635769.0090222218,USD
BSEP,Innovator U.S. Equity Buffer ETF - September,CBOE,下行风险对冲,,,结构化结果,Innovator Capital Management LLC,Innovator,No Underlying Index,买权,替代品,635572.5907000001,USD
FTRI,First Trust Indxx Global Natural Resources Income ETF,NASDAQ,主题,0.369,USD,板块,AJM Ventures LLC,First Trust,Indxx Global Natural Resources Income Index,股利,净值,634721.6943566664,USD
LDSF,First Trust Low Duration Strategic Focus ETF,NASDAQ,广泛信用,0.867,USD,广阔市场，基础广泛,AJM Ventures LLC,First Trust,No Underlying Index,活跃榜,固定收入,634309.1193088889,USD
BSJV,Invesco BulletShares 2031 High Yield Corporate Bond ETF,NASDAQ,高股息率,1.712,USD,企业，基础广泛,Invesco Ltd.,Invesco,Invesco BulletShares High Yield Corporate Bond 2031 Index,子弹债券到期,固定收入,634097.5195633332,USD
AIBD,Direxion Daily AI and Big Data Bear 2X Shares,NYSE Arca,主题,0.338,USD,板块,Rafferty Asset Management LLC,Direxion,Solactive US AI & Big Data Index - Benchmark TR Gross,普通,净值,634056.3102433333,USD
BVAL,Bluemonte Large Cap Value ETF,NYSE Arca,大盘,0.407,USD,大小和样式,Cottonwood ETF Holdings LLC,Bluemonte,No Underlying Index,活跃榜,净值,633708.484404444,USD
HCRB,Hartford Core Bond ETF,CBOE,投资等级,1.461,USD,广阔市场，基础广泛,"The Hartford Insurance Group, Inc.",Hartford,No Underlying Index,活跃榜,固定收入,633404.6192811107,USD
ISHBF,iShares USD Treasury Bond 20+yr UCITS ETF USD (Accumulating),OTC,投资等级,,,政府，财政部,"BlackRock, Inc.",iShares,US Treasury 20+ Year Index,普通,固定收入,632230.8206176112,USD
CFO,VictoryShares US 500 Enhanced Volatility Wtd ETF,NASDAQ,大盘,0.975,USD,大小和样式,"Victory Capital Holdings, Inc.",VictoryShares,Nasdaq Victory U.S. Large Cap 500 Long/Cash Volatility Weighted Index,多因素,净值,631033.3513777778,USD
HUSV,First Trust Horizon Managed Volatility Domestic ETF,NYSE Arca,大盘,0.535,USD,大小和样式,AJM Ventures LLC,First Trust,No Underlying Index,活跃榜,净值,629708.6457566667,USD
SELV,SEI Enhanced Low Volatility U.S. Large Cap ETF,CBOE,大盘,0.561,USD,大小和样式,SEI Investments Co.,SEI,No Underlying Index,活跃榜,净值,627932.6252111112,USD
PBFR,PGIM Laddered S&P 500 Buffer 20 ETF,CBOE,下行风险对冲,0.00249,USD,结构化结果,"Prudential Financial, Inc.",PGIM,No Underlying Index,等于,替代品,626822.2272677778,USD
HIDV,AB US High Dividend ETF,NYSE Arca,高股息率,1.787,USD,高股息率,"Equitable Holdings, Inc.",AB Funds,No Underlying Index,活跃榜,净值,626191.3389488887,USD
GTEK,Goldman Sachs Future Tech Leaders Equity ETF,NYSE Arca,主题,,,板块,"The Goldman Sachs Group, Inc.",Goldman Sachs,No Underlying Index,活跃榜,净值,625051.8188344443,USD
XSHD,Invesco S&P SmallCap High Dividend Low Volatility ETF,CBOE,小盘,0.803,USD,大小和样式,Invesco Ltd.,Invesco,S&P SmallCap 600 Low Volatility High Dividend,多因素,净值,623303.0653211111,USD
PFFR,InfraCap REIT Preferred ETF,NYSE Arca,广泛信用,1.443,USD,企业，首选,"Virtus Investment Partners, Inc.",InfraCap,Indxx REIT Preferred Stock Index,股利,固定收入,620930.1018588891,USD
QQQP,Tradr 2X Long Innovation 100 Quarterly ETF,NASDAQ,大盘,,,大小和样式,SR Partners LLC,Tradr,No Underlying Index,交易所特定,净值,619344.0125900002,USD
BDRY,Breakwave Dry Bulk Shipping ETF,NYSE Arca,广阔市场,,,广阔市场,Amplify Holding Co. LLC,Amplify,Breakwave Dry Freight Futures Index,阶梯式,商品,618912.4907199998,USD
DECT,AllianzIM U.S. Equity Buffer10 Dec ETF,CBOE,下行风险对冲,,,结构化结果,Allianz SE,Allianz,No Underlying Index,买权,替代品,617138.0689166664,USD
KNOV,Innovator U.S. Small Cap Power Buffer ETF - November,CBOE,下行风险对冲,,,结构化结果,Innovator Capital Management LLC,Innovator,No Underlying Index,买权,替代品,615674.2170611111,USD
XOCT,FT Vest U.S. Equity Enhance & Moderate Buffer ETF - October,CBOE,下行风险对冲,,,结构化结果,AJM Ventures LLC,FT Vest,No Underlying Index,买权,替代品,614250.8048222223,USD
ILIT,iShares Lithium Miners and Producers ETF,NASDAQ,主题,0.355,USD,板块,"BlackRock, Inc.",iShares,STOXX Global Lithium Miners and Producers Index - USD - Benchmark TR Net,普通,净值,611330.7256633332,USD
PIE,Invesco Dorsey Wright Emerging Markets Momentum ETF,NASDAQ,总市场,0.539,USD,大小和样式,Invesco Ltd.,Invesco,Dorsey Wright Emerging Markets Technical Leaders Index (Net),动量,净值,611100.1340511113,USD
TDV,ProShares S&P Technology Dividend Aristocrats ETF,CBOE,信息技术,0.943,USD,板块,ProShare Advisors LLC,ProShares,S&P Technology Dividend Aristocrats,股利,净值,609478.0320233335,USD
RSPR,Invesco S&P 500 Equal Weight Real Estate ETF,NYSE Arca,房地产,0.89362,USD,板块,Invesco Ltd.,Invesco,S&P 500 Equal Weighted / Real Estate - SEC,等于,净值,608773.0685666667,USD
SOCL,Global X Social Media ETF,NASDAQ,主题,0.238,USD,板块,"Mirae Asset Global Investments Co., Ltd.",Global X,Stuttgart Solactive AG Social Media (USD)(TR),普通,净值,608391.0392322224,USD
FRNW,Fidelity Clean Energy ETF,CBOE,主题,0.254,USD,板块,FMR LLC,Fidelity,Fidelity Clean Energy Index,ESG,净值,608239.7275255556,USD
ENPX,Tradr 2X Long ENPH Daily ETF,CBOE,信息技术,,,板块,SR Partners LLC,Tradr,No Underlying Index,普通,净值,607777.4273522221,USD
PXE,Invesco Energy Exploration & Production ETF,NYSE Arca,能源,0.832,USD,板块,Invesco Ltd.,Invesco,Dynamic Energy Exploration & Production Intellidex Index (AMEX),多因素,净值,607369.20404,USD
QVML,Invesco S&P 500 QVM Multi-factor ETF,NYSE Arca,大盘,0.441,USD,大小和样式,Invesco Ltd.,Invesco,"S&P 500 Quality, Value & Momentum Top 90% Multi-Factor Index",多因素,净值,607033.7688122223,USD
MSTB,LHA Market State Tactical Beta ETF,CBOE,大盘,0.164,USD,大小和样式,Little Harbor Advisors LLC,Little Harbor Advisors,No Underlying Index,活跃榜,净值,604865.3819311111,USD
JHCB,John Hancock Corporate Bond ETF,NYSE Arca,投资等级,1.083,USD,企业，基础广泛,Manulife Financial Corp.,John Hancock,No Underlying Index,活跃榜,固定收入,603216.0604311111,USD
ISGAF,iShares Core Global Aggregate Bond UCITS ETF Accum Hedged USD,OTC,投资等级,,,广阔市场，基础广泛,"BlackRock, Inc.",iShares,Bloomberg Global Aggregate Bond Index,普通,固定收入,599082.8539133337,USD
RBUF,Innovator U.S. Small Cap 10 Buffer ETF - Quarterly,CBOE,下行风险对冲,,,结构化结果,Innovator Capital Management LLC,Innovator,No Underlying Index,买权,替代品,599020.1464333333,USD
XFLX,FundX Flexible ETF,NYSE Arca,广泛信用,2.192,USD,广阔市场，基础广泛,CI Financial Corp.,FundX,No Underlying Index,活跃榜,固定收入,598684.5085766664,USD
IVSRF,iShares USD Floating Rate Bond UCITS ETF USD,OTC,投资等级,,,企业，基础广泛,"BlackRock, Inc.",iShares,Bloomberg US Floating Rate Notes (<5 Y),普通,固定收入,597707.9279188887,USD
CFA,VictoryShares US 500 Volatility Wtd ETF,NASDAQ,大盘,1.196,USD,大小和样式,"Victory Capital Holdings, Inc.",VictoryShares,Nasdaq Victory U.S. Large Cap 500 Volatility Weighted Index,多因素,净值,595644.6834533332,USD
GEND,Genter Capital Dividend Income ETF,NYSE Arca,高股息率,0.243,USD,高股息率,The Mcivy Co. LLC,Genter Capital,No Underlying Index,活跃榜,净值,594761.1777055555,USD
YQQQ,YieldMax Short N100 Option Income Strategy ETF,NASDAQ,大盘,3.672,USD,大小和样式,Toroso Investments Topco LLC,YieldMax,No Underlying Index,买权,净值,594492.13223,USD
MSDD,GraniteShares 2x Short MSTR Daily ETF,NASDAQ,信息技术,,,板块,"GraniteShares, Inc.",GraniteShares,No Underlying Index,普通,净值,593931.6509933332,USD
XMTIF,iShares Core MSCI EMU UCITS ETF,OTC,总市场,,,大小和样式,"BlackRock, Inc.",iShares,MSCI EMU,普通,净值,591554.7613988889,USD
GAPR,FT Vest U.S. Equity Moderate Buffer Fund - Apr,CBOE,下行风险对冲,,,结构化结果,AJM Ventures LLC,FT Vest,No Underlying Index,买权,替代品,591219.9874944445,USD
MMTM,State Street SPDR S&P 1500 Momentum Tilt ETF,NYSE Arca,总市场,2.513,USD,大小和样式,State Street Corp.,SPDR,S&P 1500 Positive Momentum Tilt Index,动量,净值,591176.7027444445,USD
HYTI,FT Vest High Yield & Target Income ETF,NYSE Arca,收入,2.109,USD,结构化结果,AJM Ventures LLC,FT Vest,No Underlying Index,买权,替代品,590365.8643188889,USD
TPZ,Tortoise Electrification Infrastructure ETF,NYSE,主题,0.814,USD,板块,TortoiseEcofin Investments LLC,Tortoise,No Underlying Index,活跃榜,净值,589892.6269822222,USD
JULW,AllianzIM U.S. Equity Buffer20 Jul ETF,CBOE,下行风险对冲,,,结构化结果,Allianz SE,Allianz,No Underlying Index,买权,替代品,589761.32125,USD
BLGR,Bluemonte Large Cap Growth ETF,NYSE Arca,大盘,0.0979,USD,大小和样式,Cottonwood ETF Holdings LLC,Bluemonte,No Underlying Index,活跃榜,净值,589041.6798955549,USD
DOGD,Tradr 2X Long DDOG Daily ETF,CBOE,信息技术,,,板块,SR Partners LLC,Tradr,No Underlying Index,普通,净值,588522.3733466667,USD
AFRU,T-REX 2X Long AFRM Daily Target ETF,CBOE,财务指标,,,板块,Tuttle Capital Management LLC,T-Rex,Affirm Holdings Inc - USD - Benchmark Price Return,普通,净值,587945.2262133332,USD
ICAP,Infrastructure Capital Equity Income ETF,NYSE Arca,总市场,2.519,USD,大小和样式,Infrastructure Capital Advisors LLC,InfraCap,No Underlying Index,活跃榜,净值,587937.9363188888,USD
MMCA,NYLI MacKay California Muni Intermediate ETF,NYSE Arca,投资等级,0.737,USD,政府、地方当局/市政府,New York Life Insurance Co.,New York Life Investments,No Underlying Index,活跃榜,固定收入,587548.9722544446,USD
QCJA,FT Vest Nasdaq-100 Conservative Buffer ETF - January,CBOE,下行风险对冲,,,结构化结果,AJM Ventures LLC,FT Vest,No Underlying Index,买权,替代品,587461.8434866666,USD
HYXF,iShares ESG Advanced High Yield Corporate Bond ETF,NASDAQ,高股息率,2.923,USD,企业，基础广泛,"BlackRock, Inc.",iShares,Bloomberg MSCI US High Yield Corporate Choice ESG Screened,ESG,固定收入,587392.4334477779,USD
STBF,Performance Trust Short Term Bond ETF,CBOE,广泛信用,1.278,USD,广阔市场，基础广泛,PTAM Holdings LLC,Performance Trust,No Underlying Index,活跃榜,固定收入,584078.6628477778,USD
ZFEB,Innovator Equity Defined Protection ETF - 1 Yr February,CBOE,下行风险对冲,,,结构化结果,Innovator Capital Management LLC,Innovator,No Underlying Index,领口期权,替代品,582262.5007433331,USD
FLAU,Franklin FTSE Australia ETF,NYSE Arca,总市场,1.022,USD,大小和样式,"Franklin Resources, Inc.",Franklin,FTSE Australia RIC Capped Index,普通,净值,581979.42723,USD
TSMZ,Direxion Daily TSM Bear 1X Shares,NASDAQ,信息技术,0.591,USD,板块,Rafferty Asset Management LLC,Direxion,"Taiwan Semiconductor Manufacturing Co., Ltd. Sponsored ADR",普通,净值,581936.0827955559,USD
OMFS,Invesco Russell 2000 Dynamic Multifactor ETF,CBOE,小盘,0.355,USD,大小和样式,Invesco Ltd.,Invesco,Russell 2000 Invesco Dynamic Multifactor Index,多因素,净值,581236.72627,USD
FCPI,Fidelity Stocks for Inflation ETF,CBOE,总市场,0.863,USD,大小和样式,FMR LLC,Fidelity,Fidelity Stocks for Inflation Factor,多因素,净值,580552.340007778,USD
PBJ,Invesco Food & Beverage ETF,NYSE Arca,必需消费品,0.822,USD,板块,Invesco Ltd.,Invesco,Dynamic Food & Beverage Intellidex Index (AMEX),多因素,净值,579775.7470244445,USD
BRHY,iShares High Yield Active ETF,NASDAQ,高股息率,3.456,USD,企业，基础广泛,"BlackRock, Inc.",iShares,No Underlying Index,活跃榜,固定收入,579141.2715922219,USD
HSCZ,iShares Currency Hedged MSCI EAFE Small-Cap ETF,NYSE Arca,小盘,1.266,USD,大小和样式,"BlackRock, Inc.",iShares,MSCI EAFE Small Cap 100% Hedged to USD Net Variant,普通,净值,578272.7514162777,USD
BOEG,Leverage Shares 2X Long BA Daily ETF,NASDAQ,工业,,,板块,ETP Holding Co. LLC,Leverage Shares,No Underlying Index,普通,净值,577992.24119,USD
NAPR,Innovator Growth-100 Power Buffer ETF - April,CBOE,下行风险对冲,,,结构化结果,Innovator Capital Management LLC,Innovator,No Underlying Index,买权,替代品,576654.8664255557,USD
SOVF,Sovereign's Capital Flourish Fund,NYSE Arca,总市场,0.226,USD,大小和样式,Sovereign's Capital Management LLC,Sovereign's,No Underlying Index,活跃榜,净值,576153.2400222218,USD
VGRSF,Vanguard Global Aggregate Bond UCITS ETF Accum Shs Hedged USD,OTC,投资等级,,,广阔市场，基础广泛,"The Vanguard Group, Inc.",Vanguard,Bloomberg Global Aggregate Float-Adjusted and Scaled,普通,固定收入,575273.6285055557,USD
BIGY,YieldMax Target 12 Big 50 Option Income ETF,NYSE Arca,大盘,6.055,USD,大小和样式,Toroso Investments Topco LLC,YieldMax,No Underlying Index,活跃榜,净值,575256.5951966667,USD
KMLI,KraneShares 2x Long MELI Daily ETF,NASDAQ,非必需消费品,1.467,USD,板块,China International Capital Corp. Ltd.,KraneShares,"MercadoLibre, Inc. - USD - Benchmark Price Return",普通,净值,574770.9363877778,USD
WCAP,WarCap Unconstrained Equity ETF,NYSE Arca,总市场,0.0036,USD,大小和样式,"Warren Capital Management, Inc.",WarCap,No Underlying Index,活跃榜,净值,573991.22132,USD
CPSL,Calamos Laddered S&P 500 Structured Alt Protection ETF,CBOE,下行风险对冲,,,结构化结果,"Calamos Family Partners, Inc.",Calamos,No Underlying Index,等于,替代品,573974.7142533335,USD
BTCC,Grayscale Bitcoin Covered Call ETF,NYSE Arca,做多比特币，做空美元,19.666,USD,对,"Digital Currency Group, Inc.",Grayscale,No Underlying Index,买权,货币,573608.4444411114,USD
PVEX,TrueShares ConVex Protect ETF,CBOE,目标结果,0.02256,USD,资产分配,Truemark Group LLC,TrueShares,No Underlying Index,活跃榜,资产分配,572871.3388066667,USD
KBAB,KraneShares 2x Long BABA Daily ETF,NASDAQ,非必需消费品,8.544,USD,板块,China International Capital Corp. Ltd.,KraneShares,Alibaba Group Holding Limited Sponsored ADR - USD - Benchmark Price Return,普通,净值,568377.8196511113,USD
LMTL,Direxion Daily LMT Bull 2X ETF,NASDAQ,工业,0.41504,USD,板块,Rafferty Asset Management LLC,Direxion,Lockheed Martin Corporation - Benchmark Price Return,普通,净值,568110.6344399998,USD
INEQ,Columbia International Equity Income ETF,NYSE Arca,总市场,0.66243,USD,大小和样式,"Ameriprise Financial, Inc.",Columbia,No Underlying Index,活跃榜,净值,568068.5928444447,USD
GSIB,Themes Global Systemically Important Banks ETF,NASDAQ,财务指标,0.887,USD,板块,ETP Holding Co. LLC,Themes,No Underlying Index,活跃榜,净值,567643.2847922223,USD
TESL,Simplify Volt TSLA Revolution ETF,NYSE Arca,非必需消费品,5.203,USD,板块,"Simplify Asset Management, Inc.",Simplify,No Underlying Index,活跃榜,净值,566028.9126300002,USD
ISHPF,iShares EM Dividend UCITS ETF,OTC,高股息率,1.0044,USD,高股息率,"BlackRock, Inc.",iShares,Dow Jones Emerging Markets Select Dividend,基本面,净值,564780.1929433334,USD
ARMU,T-REX 2X Long ARM Daily Target ETF,CBOE,信息技术,,,板块,Tuttle Capital Management LLC,T-Rex,ARM Holdings PLC Sponsored ADR,普通,净值,563758.7856577777,USD
MBCC,Monarch Blue Chips Core Index ETF,CBOE,大盘,0.0982,USD,大小和样式,Kingsview Partners LLC,Monarch,Monarch Blue Chips Core Index,基本面,净值,563073.8655555558,USD
GRW,TCW Durable Growth ETF,NASDAQ,总市场,0.042584,USD,大小和样式,"The TCW Group, Inc.",TCW,No Underlying Index,活跃榜,净值,563022.3726577782,USD
SHE,State Street SPDR MSCI USA Gender Diversity ETF,NYSE Arca,总市场,1.557,USD,大小和样式,State Street Corp.,SPDR,MSCI USA Gender Diversity Select Index - USD - Benchmark TR Gross,ESG,净值,562538.0451688888,USD
XOMX,Direxion Daily XOM Bull 2X Shares,NASDAQ,能源,0.5,USD,板块,Rafferty Asset Management LLC,Direxion,Exxon Mobil Corporation - USD - Benchmark Price Return,普通,净值,561761.514262222,USD
GSC,Goldman Sachs Small Cap Equity ETF,NYSE Arca,小盘,0.08616,USD,大小和样式,"The Goldman Sachs Group, Inc.",Goldman Sachs,Russell 2000,活跃榜,净值,561162.3093344445,USD
MNRS,Grayscale Bitcoin Miners ETF,NYSE Arca,主题,0,USD,板块,"Digital Currency Group, Inc.",Grayscale,Indxx Bitcoin Miners Index - Benchmark TR Net,普通,净值,561031.6820711108,USD
NUHY,Nuveen ESG High Yield Corporate Bond ETF,NYSE Arca,高股息率,1.407,USD,企业，基础广泛,TIAA Board of Governors,Nuveen,Bloomberg MSCI US High Yield Very Liquid ESG Select,ESG,固定收入,560717.0485577781,USD
FEUZ,First Trust Eurozone AlphaDEX ETF,NASDAQ,总市场,1.728,USD,大小和样式,AJM Ventures LLC,First Trust,Nasdaq AlphaDex Eurozone Index,多因素,净值,560468.3236533332,USD
EDGU,3EDGE Dynamic US Equity ETF,NYSE Arca,总市场,0.174,USD,大小和样式,3EDGE Asset Management LP,3Edge,No Underlying Index,活跃榜,净值,558836.203791111,USD
GMEY,YieldMax GME Option Income Strategy ETF,NYSE Arca,非必需消费品,9.331,USD,板块,Toroso Investments Topco LLC,YieldMax,No Underlying Index,买权,净值,558085.9520555557,USD
TPOR,Direxion Daily Transportation Bull 3X Shares,NYSE Arca,工业,0.49365,USD,板块,Rafferty Asset Management LLC,Direxion,S&P Transportation Select Industry FMC Capped Index,普通,净值,557971.481888889,USD
GIGL,Goldman Sachs Corporate Bond ETF,NYSE Arca,投资等级,2.158,USD,企业，基础广泛,"The Goldman Sachs Group, Inc.",Goldman Sachs,No Underlying Index,活跃榜,固定收入,557855.7493466667,USD
GSEU,Goldman Sachs ActiveBeta Europe Equity ETF,NYSE Arca,总市场,1.245,USD,大小和样式,"The Goldman Sachs Group, Inc.",Goldman Sachs,Goldman Sachs ActiveBeta Europe Equity,多因素,净值,557300.17603,USD
FMTM,MarketDesk Focused U.S. Momentum ETF,NASDAQ,总市场,0.0951665,USD,大小和样式,Empirical Finance LLC,MarketDesk,No Underlying Index,活跃榜,净值,557032.8070577779,USD
IDEC,Innovator International Developed Power Buffer ETF December,NYSE Arca,下行风险对冲,,,结构化结果,Innovator Capital Management LLC,Innovator,No Underlying Index,买权,替代品,556307.6501600001,USD
SHAG,WisdomTree Yield Enhanced U.S. Short-Term Aggregate Bond Fund,CBOE,投资等级,2.097,USD,广阔市场，基础广泛,"WisdomTree, Inc.",WisdomTree,Bloomberg Short US Aggregate Enhanced Yield,多因素,固定收入,555875.5430500002,USD
PCGG,Polen Capital Global Growth ETF,NYSE Arca,大盘,,,大小和样式,Eurazeo SE,Polen,No Underlying Index,活跃榜,净值,555811.1105411109,USD
JUST,Goldman Sachs JUST U.S. Large Cap Equity ETF,NYSE Arca,大盘,0.982,USD,大小和样式,"The Goldman Sachs Group, Inc.",Goldman Sachs,JUST US Large Cap Diversified  (TR),ESG,净值,555655.9567411114,USD
DABS,Doubleline ABS ETF,NYSE Arca,广泛信用,2.329,USD,广阔市场，资产支持,Doubleline ETF Holdings LP,DoubleLine,No Underlying Index,活跃榜,固定收入,554629.1384977777,USD
TRPA,Hartford AAA CLO ETF,CBOE,投资等级,2.098,USD,企业，银行贷款,"The Hartford Insurance Group, Inc.",Hartford,No Underlying Index,活跃榜,固定收入,554172.9355622225,USD
ITEQ,Amplify BlueStar Israel Technology ETF,NYSE Arca,主题,0.492,USD,板块,Amplify Holding Co. LLC,Amplify,BlueStar Israel Global Technology Index,普通,净值,551817.7095955556,USD
APMU,ActivePassive Intermediate Municipal Bond ETF,NYSE Arca,广泛信用,0.649,USD,政府、地方当局/市政府,"Envestnet, Inc.",ActivePassive,No Underlying Index,活跃榜,固定收入,551802.7866455553,USD
VEGI,iShares MSCI Agriculture Producers ETF,NYSE Arca,主题,0.9,USD,板块,"BlackRock, Inc.",iShares,MSCI ACWI Select Agriculture Producers IMI,普通,净值,550507.1558877776,USD
JIREF,JPM USD Ultra-Short Income Active UCITS ETF Accum Shs USD,OTC,投资等级,,,广阔市场，基础广泛,JPMorgan Chase & Co.,JPMorgan,No Underlying Index,活跃榜,固定收入,549965.4381255558,USD
QDTY,YieldMax Nasdaq 100 0DTE Covered Call Strategy ETF,NASDAQ,大盘,12.53,USD,大小和样式,Toroso Investments Topco LLC,YieldMax,No Underlying Index,活跃榜,净值,549597.7375777778,USD
FHYS,Federated Hermes Short Duration High Yield ETF,NYSE Arca,高股息率,1.332,USD,企业，基础广泛,"Federated Hermes, Inc.",Federated Hermes,No Underlying Index,活跃榜,固定收入,549435.2220377775,USD
NBJP,Neuberger Japan Equity ETF,NYSE Arca,总市场,0.705,USD,大小和样式,NBSH Acquisition LLC,Neuberger Berman,No Underlying Index,活跃榜,净值,549284.4377200002,USD
DEXC,Dimensional Emerging Markets ex China Core Equity ETF,NYSE Arca,总市场,1.195,USD,大小和样式,"Dimensional Holdings, Inc.",Dimensional,No Underlying Index,活跃榜,净值,548028.3997655555,USD
COIA,ProShares Ultra COIN,NYSE Arca,财务指标,0.512,USD,板块,ProShare Advisors LLC,ProShares,"Coinbase Global, Inc. Class A",普通,净值,547055.7632622223,USD
ZSEP,Innovator Equity Defined Protection ETF - 1 Yr September,CBOE,下行风险对冲,,,结构化结果,Innovator Capital Management LLC,Innovator,No Underlying Index,领口期权,替代品,546947.5605088884,USD
IHYBF,iShares Euro High Yield Corp Bond UCITS ETF Hedged USD Accumulating,OTC,高股息率,,,企业，基础广泛,"BlackRock, Inc.",iShares,Markit iBoxx Euro Liquid High Yield Index,普通,固定收入,546594.6816533335,USD
MFUS,PIMCO RAFI Dynamic Multi-Factor U.S. Equity ETF,NYSE Arca,总市场,0.87,USD,大小和样式,Allianz SE,PIMCO,RAFI Dynamic Multi-Factor U.S. Index,多因素,净值,544994.5993844444,USD
USEP,Innovator U.S. Equity Ultra Buffer ETF - September,CBOE,下行风险对冲,,,结构化结果,Innovator Capital Management LLC,Innovator,No Underlying Index,买权,替代品,544924.6087488892,USD
CPTFF,Xtrackers S&P 500 Equal Weight UCITS ETF,OTC,大盘,,,大小和样式,Deutsche Bank AG,Xtrackers,S&P 500 Equal Weighted,等于,净值,543897.1437811113,USD
FDM,First Trust Dow Jones Select MicroCap Index Fund,NYSE Arca,微型盘,1.139,USD,大小和样式,AJM Ventures LLC,First Trust,DJ Select Micro-Cap,基本面,净值,543094.6262733336,USD
NSEP,Innovator Growth-100 Power Buffer ETF - September,CBOE,下行风险对冲,,,结构化结果,Innovator Capital Management LLC,Innovator,No Underlying Index,买权,替代品,542905.8641022219,USD
RAFE,PIMCO RAFI ESG U.S. ETF,NYSE Arca,总市场,0.7,USD,大小和样式,Allianz SE,PIMCO,RAFI ESG US Index,基本面,净值,542749.7345277776,USD
SPYH,NEOS S&P 500 Hedged Equity Income ETF,CBOE,大盘,4.098,USD,大小和样式,NEOS Investments LLC,Neos,No Underlying Index,活跃榜,净值,542684.1665688887,USD
GMET,VanEck Green Metals ETF,NYSE Arca,材料,0.683,USD,板块,Van Eck Associates Corp.,VanEck,MVIS Global Clean-Tech Metals,普通,净值,542319.6420066671,USD
PYPY,YieldMax PYPL Option Income Strategy ETF,NYSE Arca,财务指标,25.494,USD,板块,Toroso Investments Topco LLC,YieldMax,No Underlying Index,买权,净值,542053.1342855555,USD
AVUQ,Avantis U.S. Quality ETF Shs Avantis US Growth Equity ETF,NASDAQ,大盘,0.19,USD,大小和样式,"American Century Cos., Inc.",Avantis,No Underlying Index,活跃榜,净值,541451.09798,USD
EBI,Longview Advantage ETF,NASDAQ,总市场,0.595,USD,大小和样式,"Focus Financial Partners, Inc.",Longview,No Underlying Index,活跃榜,净值,541255.9070322221,USD
GXIG,Global X Investment Grade Corporate Bond ETF,NYSE Arca,投资等级,1.237,USD,企业，基础广泛,"Mirae Asset Global Investments Co., Ltd.",Global X,No Underlying Index,活跃榜,固定收入,539510.1351933335,USD
ISEP,Innovator International Developed Power Buffer ETF - September,NYSE Arca,下行风险对冲,,,结构化结果,Innovator Capital Management LLC,Innovator,No Underlying Index,买权,替代品,538512.8561511111,USD
RSBT,Return Stacked Bonds & Managed Futures ETF,CBOE,全球宏观,0.574,USD,对冲基金策略,Toroso Investments Topco LLC,Return Stacked,No Underlying Index,活跃榜,替代品,538416.5281344445,USD
DXIV,Dimensional International Vector Equity ETF,NYSE Arca,总市场,1.628,USD,大小和样式,"Dimensional Holdings, Inc.",Dimensional,No Underlying Index,活跃榜,净值,533787.0283222223,USD
FLGR,Franklin FTSE Germany ETF,NYSE Arca,总市场,0.578,USD,大小和样式,"Franklin Resources, Inc.",Franklin,FTSE Germany RIC Capped Index,普通,净值,532658.6196111115,USD
PSCH,Invesco S&P SmallCap Health Care ETF,NASDAQ,卫生保健,0.01877,USD,板块,Invesco Ltd.,Invesco,S&P SmallCap 600 Capped Health Care Index - Benchmark TR Gross,普通,净值,532336.17328,USD
EMTL,State Street DoubleLine Emerging Markets Fixed Income ETF,CBOE,广泛信用,2.204,USD,广阔市场，基础广泛,State Street Corp.,SPDR,No Underlying Index,活跃榜,固定收入,532257.7827555556,USD
